{
  "schemaVersion": 1,
  "dataset": "radar-pipeline-health",
  "generatedAt": "2026-08-28T16:50:20.649Z",
  "privacy": "Aggregate counters only; no candidate names or detector payloads.",
  "current": {
    "publishedSignals": 50,
    "sourceStates": {
      "CertStream": "healthy",
      "URLScan": "healthy",
      "HECAVEX": "healthy"
    },
    "sourceRecords": {
      "CertStream": 41,
      "URLScan": 9,
      "HECAVEX": 1
    },
    "certstream": {
      "generatedAt": "2026-08-28T16:49:49.301Z",
      "lastSuccessAt": "2026-08-28T16:49:49.301Z",
      "freshness": {
        "status": "current",
        "referenceAt": "2026-08-28T16:49:49.301Z",
        "ageSeconds": 0
      },
      "latestAttempt": {
        "startedAt": "2026-08-28T16:41:28.978Z",
        "endedAt": "2026-08-28T16:49:49.301Z",
        "outcome": "healthy-empty",
        "listeningSeconds": 479.998,
        "messages": 167205,
        "dnsNames": 306780,
        "matches": 0,
        "newRecords": 0
      }
    },
    "urlscan": {
      "generatedAt": "2026-08-26T16:36:54.023Z",
      "configured": true,
      "lastOutcome": "completed",
      "lastAttemptAt": "2026-08-26T16:36:54.023Z",
      "checkpointCoverage": {
        "queries": 3,
        "complete": 1,
        "partial": 2,
        "backlog": 2,
        "oldestBacklogProgressAt": "2026-08-26T16:36:54.023Z"
      }
    },
    "ctSearch": {
      "generatedAt": "2026-08-26T16:37:48.107Z",
      "latestRun": {
        "startedAt": "2026-08-26T16:37:09.865Z",
        "endedAt": "2026-08-26T16:37:48.107Z",
        "outcome": "partial",
        "queriesAttempted": 6,
        "queriesCompleted": 1,
        "queriesBacklogged": 0,
        "rowsProcessed": 0,
        "dnsNames": 0,
        "matches": 0,
        "newRecords": 0,
        "failureCodes": [
          "provider-http"
        ]
      },
      "provider": "crt.sh"
    },
    "domainContext": {
      "generatedAt": "2026-08-26T16:38:53.533Z",
      "latestRun": {
        "startedAt": "2026-08-26T16:38:39.559Z",
        "endedAt": "2026-08-26T16:38:53.533Z",
        "outcome": "completed",
        "attempted": 13,
        "completed": 13
      },
      "recordCount": 13
    }
  },
  "windows": [
    {
      "hours": 24,
      "from": "2026-08-27T16:50:20.649Z",
      "to": "2026-08-28T16:50:20.649Z",
      "collection": {
        "scheduledSlots": 96,
        "recordedAttempts": 98,
        "healthyAttempts": 98,
        "recordedSchedulePercent": 100.0,
        "listeningCoveragePercent": 54.43,
        "scheduledListeningCeilingPercent": 53.33,
        "expectedListeningSeconds": 47040,
        "listeningSeconds": 47027.817,
        "messages": 15568273,
        "dnsNames": 28802336,
        "outcomes": {
          "healthy-empty": 72,
          "healthy-matches": 26
        }
      },
      "screening": {
        "matches": 51,
        "newArchiveRecords": 32,
        "firstPublications": 31,
        "bySource": {
          "CertStream": 63
        }
      },
      "enrichment": {
        "observations": 0,
        "uniqueSignals": 0,
        "page": 0,
        "network": 0,
        "assessment": 0,
        "certificate": 0,
        "dns": 0,
        "rdap": 0
      },
      "publication": {
        "events": 63,
        "observations": 32,
        "statusTransitions": 31,
        "uniqueSignals": 32
      }
    },
    {
      "hours": 168,
      "from": "2026-08-21T16:50:20.649Z",
      "to": "2026-08-28T16:50:20.649Z",
      "collection": {
        "scheduledSlots": 672,
        "recordedAttempts": 183,
        "healthyAttempts": 183,
        "recordedSchedulePercent": 27.2,
        "listeningCoveragePercent": 13.29,
        "scheduledListeningCeilingPercent": 53.33,
        "expectedListeningSeconds": 80400,
        "listeningSeconds": 80368.64,
        "messages": 27387743,
        "dnsNames": 49371662,
        "outcomes": {
          "healthy-empty": 148,
          "healthy-matches": 35
        }
      },
      "screening": {
        "matches": 64,
        "newArchiveRecords": 41,
        "firstPublications": 52,
        "bySource": {
          "CertStream": 82,
          "URLScan": 29,
          "HECAVEX": 2
        }
      },
      "enrichment": {
        "observations": 51,
        "uniqueSignals": 40,
        "page": 48,
        "network": 44,
        "assessment": 51,
        "certificate": 42,
        "dns": 0,
        "rdap": 0
      },
      "publication": {
        "events": 113,
        "observations": 61,
        "statusTransitions": 52,
        "uniqueSignals": 56
      }
    }
  ]
}
